### ISSUE TITLE
Strange issue in HTTP parsing

### ISSUE THREAD

**Issue by tsuraan** [yesodweb/wai#131]
Preliminary info: linux kernel, ghc 7.4.1, wai 1.3.0.1, warp 1.3.5.1

I have a really simple Wai program that looks like this:

``` haskell
{-# LANGUAGE OverloadedStrings #-}
module Main
( main
) where

import Control.Monad.Trans      ( liftIO )
import Network.HTTP.Types       ( status404 )
import Network.Wai              ( Application, responseLBS )
import Network.Wai.Handler.Warp ( run )

s404 ∷ Application
s404 _ = do
  liftIO $ putStrLn "Returning 404"
  return $ responseLBS status404
                       [("Content-Type", "text/plain")]
                       "Page Not Found\n"

main ∷ IO ()
main = run 8001 s404
```

So, it runs on port 8001 returning really simple 404 pages.  Now, I have two different ways I'm trying to upload a file: header first, and then a newline, and then the body, or all as a single string (the below copy/paste jobs say HTTP/1.0, but the same happens if I say HTTP/1.1).  If I send one part at a time, like so:

``` python
>>> import socket
>>> head='PUT /foo/bar HTTP/1.0\r\nContent-Type: multipart/form-data\r\nHost: 10.21.7.146\r\nContent-Length: 744\r\nAccept-Encoding: gzip, deflate\r\n'
>>> body=' Installation on OS/2\r\n --------------------\r\n You need to have the following tools installed:\r\n  * EMX GCC\r\n  * PERL\r\n  * GNU make\r\n To build the makefile, run\r\n > os2\\os2-emx\r\n This will configure OpenSSL and create OS2-EMX.mak which you then use to\r\n build the OpenSSL libraries & programs by running\r\n > make -f os2-emx.mak\r\n If that finishes successfully you will find the libraries and programs in the\r\n "out" directory.\r\n Alternatively, you can make a dynamic build that puts the library code into\r\n crypto.dll and ssl.dll by running\r\n > make -f os2-emx-dll.mak\r\n This will build the above mentioned dlls and a matching pair of import\r\n libraries in the "out_dll" directory along with the set of test programs\r\n and the openssl applicati'
>>> s=socket.socket()
>>> s.connect( ('localhost', 8001) )
>>> s.send(head)
130
>>> s.send("\r\n")
2
>>> s.send(body)
744
>>> s.recv(1024)
'HTTP/1.0 404 Not Found\r\nServer: Warp/1.3.4.1\r\nContent-Type: text/plain\r\n\r\nPage Not Found\n'
```

I get the "Returning 404" printout where I'm running my basic server.  If I send everything at once, like so:

``` python
>>> import socket
>>> head='PUT /foo/bar HTTP/1.0\r\nContent-Type: multipart/form-data\r\nHost: 10.21.7.146\r\nContent-Length: 744\r\nAccept-Encoding: gzip, deflate\r\n'
>>> body=' Installation on OS/2\r\n --------------------\r\n You need to have the following tools installed:\r\n  * EMX GCC\r\n  * PERL\r\n  * GNU make\r\n To build the makefile, run\r\n > os2\\os2-emx\r\n This will configure OpenSSL and create OS2-EMX.mak which you then use to\r\n build the OpenSSL libraries & programs by running\r\n > make -f os2-emx.mak\r\n If that finishes successfully you will find the libraries and programs in the\r\n "out" directory.\r\n Alternatively, you can make a dynamic build that puts the library code into\r\n crypto.dll and ssl.dll by running\r\n > make -f os2-emx-dll.mak\r\n This will build the above mentioned dlls and a matching pair of import\r\n libraries in the "out_dll" directory along with the set of test programs\r\n and the openssl applicati'
>>> s=socket.socket()
>>> s.connect( ('localhost', 8001) )
>>> s.send(head + "\r\n" + body)
876
>>> s.recv(1024)
```

Then the web server never prints out "Returning 404", and the python recv() call hangs until wai's slowloris protection kicks in.  So, it looks like the HTTP parser is somehow sensitive to packet boundaries.  For fun, I ran a tcpdump on both methods of doing things, and you can see that the first method sends three packets, while the second method sends only one.

tcpdump for the first python session:

```
22:11:50.752609 IP 127.0.0.1.46686 > 127.0.0.1.8001: Flags [S], seq 2350796061, win 32792, options [mss 16396,sackOK,TS val 2226868 ecr 0,nop,wscale 7], length 0
E..<..@.@............^.A..M..........0....@....
.!..........
22:11:50.752621 IP 127.0.0.1.8001 > 127.0.0.1.46686: Flags [S.], seq 2350998159, ack 2350796062, win 32768, options [mss 16396,sackOK,TS val 2226868 ecr 2226868,nop,wscale 7], length 0
E..<..@.@.<..........A.^.!b...M......0....@....
.!...!......
22:11:50.752629 IP 127.0.0.1.46686 > 127.0.0.1.8001: Flags [.], ack 1, win 257, options [nop,nop,TS val 2226868 ecr 2226868], length 0
E..4..@.@............^.A..M..!b......(.....
.!...!..
22:11:52.951514 IP 127.0.0.1.46686 > 127.0.0.1.8001: Flags [P.], seq 1:131, ack 1, win 257, options [nop,nop,TS val 2227417 ecr 2226868], length 130
E.....@.@............^.A..M..!b............
.!...!..PUT /foo/bar HTTP/1.0
Content-Type: multipart/form-data
Host: 10.21.7.146
Content-Length: 744
Accept-Encoding: gzip, deflate

22:11:52.951534 IP 127.0.0.1.8001 > 127.0.0.1.46686: Flags [.], ack 131, win 256, options [nop,nop,TS val 2227417 ecr 2227417], length 0
E..4.$@.@............A.^.!b...M......(.....
.!...!..
22:11:54.911359 IP 127.0.0.1.46686 > 127.0.0.1.8001: Flags [P.], seq 131:133, ack 1, win 257, options [nop,nop,TS val 2227907 ecr 2227417], length 2
E..6..@.@............^.A..M..!b......*.....
.!...!..

22:11:54.911402 IP 127.0.0.1.8001 > 127.0.0.1.46686: Flags [.], ack 133, win 256, options [nop,nop,TS val 2227907 ecr 2227907], length 0
E..4.%@.@............A.^.!b...M......(.....
.!...!..
22:11:54.912423 IP 127.0.0.1.8001 > 127.0.0.1.46686: Flags [P.], seq 1:90, ack 133, win 256, options [nop,nop,TS val 2227908 ecr 2227907], length 89
E....&@.@..B.........A.^.!b...M............
.!...!..HTTP/1.0 404 Not Found
Server: Warp/1.3.4.1
Content-Type: text/plain

Page Not Found

22:11:54.912441 IP 127.0.0.1.46686 > 127.0.0.1.8001: Flags [.], ack 90, win 257, options [nop,nop,TS val 2227908 ecr 2227908], length 0
E..4..@.@............^.A..M..!b......(.....
.!...!..
22:11:56.847505 IP 127.0.0.1.46686 > 127.0.0.1.8001: Flags [P.], seq 133:877, ack 90, win 257, options [nop,nop,TS val 2228391 ecr 2227908], length 744
E.....@.@..+.........^.A..M..!b............
."...!.. Installation on OS/2
 --------------------
 You need to have the following tools installed:
  * EMX GCC
  * PERL
  * GNU make
 To build the makefile, run
 > os2\os2-emx
 This will configure OpenSSL and create OS2-EMX.mak which you then use to
 build the OpenSSL libraries & programs by running
 > make -f os2-emx.mak
 If that finishes successfully you will find the libraries and programs in the
 "out" directory.
 Alternatively, you can make a dynamic build that puts the library code into
 crypto.dll and ssl.dll by running
 > make -f os2-emx-dll.mak
 This will build the above mentioned dlls and a matching pair of import
 libraries in the "out_dll" directory along with the set of test programs
 and the openssl applicati
22:11:56.847686 IP 127.0.0.1.8001 > 127.0.0.1.46686: Flags [F.], seq 90, ack 877, win 256, options [nop,nop,TS val 2228391 ecr 2228391], length 0
E..4.'@.@............A.^.!b...P......(.....
."..."..
22:11:56.883819 IP 127.0.0.1.46686 > 127.0.0.1.8001: Flags [.], ack 91, win 257, options [nop,nop,TS val 2228401 ecr 2228391], length 0
E..4..@.@............^.A..P..!b......(.....
."..."..
```

tcpdump for second session:

```
22:08:58.223808 IP 127.0.0.1.46515 > 127.0.0.1.8001: Flags [S], seq 10166954, win 32792, options [mss 16396,sackOK,TS val 2183736 ecr 0,nop,wscale 7], length 0
E..<p.@.@..............A.."..........0....@....
.!R8........
22:08:58.223819 IP 127.0.0.1.8001 > 127.0.0.1.46515: Flags [S.], seq 4173511197, ack 10166955, win 32768, options [mss 16396,sackOK,TS val 2183736 ecr 2183736,nop,wscale 7], length 0
E..<..@.@.<..........A........"......0....@....
.!R8.!R8....
22:08:58.223827 IP 127.0.0.1.46515 > 127.0.0.1.8001: Flags [.], ack 1, win 257, options [nop,nop,TS val 2183736 ecr 2183736], length 0
E..4p.@.@..#...........A.."..........(.....
.!R8.!R8
22:09:00.758851 IP 127.0.0.1.46515 > 127.0.0.1.8001: Flags [P.], seq 1:877, ack 1, win 257, options [nop,nop,TS val 2184369 ecr 2183736], length 876
E...p.@.@..............A.."................
.!T..!R8PUT /foo/bar HTTP/1.0
Content-Type: multipart/form-data
Host: 10.21.7.146
Content-Length: 744
Accept-Encoding: gzip, deflate

 Installation on OS/2
 --------------------
 You need to have the following tools installed:
  * EMX GCC
  * PERL
  * GNU make
 To build the makefile, run
 > os2\os2-emx
 This will configure OpenSSL and create OS2-EMX.mak which you then use to
 build the OpenSSL libraries & programs by running
 > make -f os2-emx.mak
 If that finishes successfully you will find the libraries and programs in the
 "out" directory.
 Alternatively, you can make a dynamic build that puts the library code into
 crypto.dll and ssl.dll by running
 > make -f os2-emx-dll.mak
 This will build the above mentioned dlls and a matching pair of import
 libraries in the "out_dll" directory along with the set of test programs
 and the openssl applicati
22:09:00.758869 IP 127.0.0.1.8001 > 127.0.0.1.46515: Flags [.], ack 877, win 256, options [nop,nop,TS val 2184369 ecr 2184369], length 0
E..4.&@.@.T..........A........&......(.....
.!T..!T.
22:09:35.327033 IP 127.0.0.1.8001 > 127.0.0.1.46515: Flags [F.], seq 1, ack 877, win 256, options [nop,nop,TS val 2193011 ecr 2184369], length 0
E..4.'@.@.T..........A........&......(.....
.!vs.!T.
22:09:35.327445 IP 127.0.0.1.46515 > 127.0.0.1.8001: Flags [.], ack 2, win 257, options [nop,nop,TS val 2193011 ecr 2193011], length 0
E..4p.@.@..!...........A..&..........(.....
.!vs.!vs
```
